{
  "$schema": "http://json-schema.org/draft-07/schema#",
  "$id": "https://raw.githubusercontent.com/Dodeun/doden-contract/v3/platform.schema.json",
  "title": "Manifest",
  "description": "A Project's identity, and the commands the platform runs inside its images, in one committed file. The two halves have two owners: the identity - slug, appName, appHost, profile, contractVersion - is written by `project new` and never edited, because everything outside the repository was named after it; the commands, inside the Add-ons that need them, belong to the Project and change when its stack does. A Prototype also carries a `prototype` block, whose presence only a promotion removes and whose settings change by a commit. Read by the Project's workflows, by the contract check, and by anyone who opens it (ADR-0010).",
  "type": "object",
  "additionalProperties": false,
  "required": ["slug", "appName", "appHost", "profile", "addons", "contractVersion"],
  "properties": {
    "$schema": {
      "type": "string",
      "description": "Optional. Points an editor at this file; the checker reads the schema from its own checkout, not from the network."
    },
    "slug": {
      "type": "string",
      "pattern": "^[a-z0-9][a-z0-9-]*[a-z0-9]$",
      "maxLength": 40,
      "description": "The Project's name everywhere a machine reads it: the Compose project name, the Traefik router and service names, the directory on the host, the image repository. Lower case, digits and hyphens. A leading digit is allowed, because a real Project has one and Compose accepts it."
    },
    "appName": {
      "type": "string",
      "minLength": 1,
      "maxLength": 80,
      "description": "The Project's name where a person reads it."
    },
    "appHost": {
      "type": "string",
      "maxLength": 253,
      "pattern": "^[a-z0-9]([a-z0-9-]*[a-z0-9])?([.][a-z0-9]([a-z0-9-]*[a-z0-9])?)+$",
      "description": "The public hostname. Read at image-build time as well as at deploy time - the frontend bundle is compiled against it - so changing it means republishing, not redeploying."
    },
    "profile": {
      "type": "string",
      "enum": ["node-web", "base-dockerfile"],
      "description": "The Template this Project was copied from, which is what the Template decided on its behalf beyond the contract: how images are built, how tests run, and in some Profiles a language. `base-dockerfile` names none. A closed list on purpose: the contract names no language, and a Profile is the one place a language may appear, so adding one is a contract version bump rather than a free-text field."
    },
    "addons": {
      "type": "object",
      "additionalProperties": false,
      "properties": {
        "database": {
          "type": "object",
          "additionalProperties": false,
          "required": ["provider", "migrate", "seed"],
          "properties": {
            "provider": {
              "type": "string",
              "pattern": "^[a-z][a-z0-9]*$",
              "description": "Which engine backs this Project's database. The platform runs exactly one, and the `addon-provider` rule is where that list lives - so a provider the platform does not run is reported in the same verdict as every other rule rather than as a schema error nobody can read beside the rest. The key is here so that the Manifest stops asserting, in its own shape, that there could never be a second one; adding a second value is a change to ADR-0005 rather than a change to the shape of this file."
            },
            "migrate": {
              "type": "object",
              "additionalProperties": false,
              "required": ["service", "command"],
              "properties": {
                "service": {
                  "type": "string",
                  "pattern": "^[a-zA-Z0-9][a-zA-Z0-9_.-]*$",
                  "description": "The Service of docker-compose.prod.yml whose image runs the command. The `addon-commands` rule checks that the Stack has it."
                },
                "command": {
                  "type": "string",
                  "minLength": 1,
                  "description": "Run as `sh -c '<command>'` in place of the image's entrypoint, in a one-off container of that Service's image, with DATABASE_URL in its environment. CONTRACT.md says why a shell."
                }
              },
              "description": "How this Project's schema is brought forward. The deploy runs it in the new release's image, before the new images serve; a failure leaves the previous Release serving. Forward only: there is no down-migration on this platform."
            },
            "seed": {
              "type": "object",
              "additionalProperties": false,
              "required": ["service", "command"],
              "properties": {
                "service": {
                  "type": "string",
                  "pattern": "^[a-zA-Z0-9][a-zA-Z0-9_.-]*$",
                  "description": "The Service of docker-compose.prod.yml whose image runs the command. The `addon-commands` rule checks that the Stack has it."
                },
                "command": {
                  "type": "string",
                  "minLength": 1,
                  "description": "Run as `sh -c '<command>'` in place of the image's entrypoint, in a one-off container of that Service's image, with DATABASE_URL in its environment. CONTRACT.md says why a shell."
                }
              },
              "description": "How an empty database is filled with synthetic data, for a Preview. Never a copy of production - that is what keeps a Preview and its testers outside production's Trust Domain. The Profile runs it on every CI run against a throwaway database, because a declared command nobody has run is a Manifest field that is false."
            }
          },
          "description": "An optional dependency on the shared Postgres (ADR-0005). Declaring it commits this Project to what docs/addons/database.md in doden-contract describes, and a copy of that document travels with the Add-on. It carries the two commands the platform runs against the database, so neither can exist without it."
        }
      },
      "description": "The optional dependencies on Shared Platform Services this Project declares (ADR-0013). Keys are the Add-ons; each value carries that Add-on's configuration, and an Add-on with nothing to configure takes an empty object. A Project with no Add-ons writes {}. Traefik and the web network are not in here: every Project depends on them and none declares them, which is what *optional* means. A capability a Project implements for itself - a login, a scraper, a third-party integration - is not an Add-on, however much code it takes and however many Projects write it."
    },
    "prototype": {
      "type": "object",
      "additionalProperties": false,
      "required": ["expires"],
      "properties": {
        "expires": {
          "type": "string",
          "description": "The last day this Prototype runs, written YYYY-MM-DD: it serves until the end of that day, Paris time. A string here and a date in the `prototype-expires` rule, so that a date written another way is reported in the verdict, naming the format, rather than refused as a schema assertion. Moved by a commit."
        },
        "accessCode": {
          "type": "string",
          "pattern": "^[2-9A-HJKMNP-Z]{5}$",
          "title": "five capital letters and digits, never 0, 1, I, L or O",
          "description": "Optional. Five capital letters and digits a visitor types to get in; without it the Prototype is public. Never 0, 1, I, L or O, which a person reading the code aloud or copying it from an e-mail confuses with each other, and never lower case, which does not survive being read aloud. Not a secret: a doorbell, not a lock, so it is committed. Changed by a commit."
        }
      },
      "description": "Present only in a Prototype, and what makes it one (ADR-0015): a Project that may be thrown away, whose data nobody backs up, served under <slug>.lab.doden.dev. Its settings change by a commit like any other file. Removing the block is a promotion, not an edit."
    },
    "contractVersion": {
      "type": "string",
      "pattern": "^v[0-9]+$",
      "description": "The major version of the Platform Contract this Project is held to, matching the tag its workflow pins and the version its CONTRACT.md carries."
    }
  }
}
