{
  "$schema": "https://raw.githubusercontent.com/Dodeun/doden-contract/v3/platform.schema.json",
  "slug": "fixture-base",
  "appName": "Fixture Base",
  "appHost": "fixture-base.example.test",
  "profile": "base-dockerfile",
  "addons": {
    "database": {
      "provider": "postgresql",
      "migrate": {
        "service": "backend",
        "command": "npm run migrate --workspace=backend"
      },
      "seed": {
        "service": "backend",
        "command": "npm run seed --workspace=backend"
      }
    }
  },
  "contractVersion": "v3"
}
